{
  "id": "recall.object.semantic",
  "name": "Object-facing semantic recall",
  "mode": "semantic",
  "allowed_scopes": [
    "repo",
    "project",
    "ecosystem"
  ],
  "preferred_kinds": [
    "claim",
    "decision",
    "pattern",
    "anchor"
  ],
  "temperature_order": [
    "warm",
    "cool",
    "frozen",
    "cold",
    "hot"
  ],
  "inspect_surface": "generated/memory_object_catalog.min.json",
  "expand_surface": "generated/memory_object_sections.full.json",
  "source_route_required": true,
  "notes": "Use when semantic recall should stay on the curated object family rather than the doctrine-facing catalog surfaces."
}
