{
  "id": "recall.lineage.router-ready",
  "name": "Router-ready lineage recall",
  "mode": "lineage",
  "allowed_scopes": [
    "project",
    "workspace",
    "ecosystem"
  ],
  "preferred_kinds": [
    "bridge",
    "claim",
    "episode",
    "anchor"
  ],
  "temperature_order": [
    "warm",
    "cool",
    "frozen",
    "cold",
    "hot"
  ],
  "inspect_surface": "generated/memory/memory_catalog.min.json",
  "capsule_surface": "generated/memory/memory_capsules.json",
  "expand_surface": "generated/memory/memory_sections.full.json",
  "source_route_required": true,
  "notes": "Use for router lineage flow that inspects doctrine ids first, hydrates through memo capsules for compact provenance posture, and opens doctrine sections only when the capsule step is insufficient."
}
