{
  "id": "recall.object.lineage",
  "name": "Object-facing lineage recall",
  "mode": "lineage",
  "allowed_scopes": [
    "project",
    "workspace",
    "ecosystem"
  ],
  "preferred_kinds": [
    "bridge",
    "claim",
    "episode",
    "anchor"
  ],
  "temperature_order": [
    "warm",
    "cool",
    "frozen",
    "cold",
    "hot"
  ],
  "inspect_surface": "generated/memory-objects/memory_object_catalog.min.json",
  "capsule_surface": "generated/memory-objects/memory_object_capsules.json",
  "expand_surface": "generated/memory-objects/memory_object_sections.full.json",
  "source_route_required": true,
  "notes": "Use for curated lineage-heavy recall when the consumer should inspect object ids first, hydrate through object capsules for compact provenance posture, and expand into full object sections only when the capsule step is insufficient."
}
